{
  "schema_version": "harness.command-manifest.v2",
  "document_role": "authoritative_workflow_interface_and_capability_catalog",
  "permission_grant": false,
  "capabilities": [
    {
      "id": "bootstrap.guided_setup",
      "display_name": "Octon Mini Guided Setup",
      "purpose": "Collect and validate reviewed bootstrap inputs for initialization, adoption, or upgrade.",
      "availability": ["bootstrap_source"],
      "command_entry_points": ["octon init setup", "octon adopt setup", "octon upgrade setup"],
      "implementation_entry_points": ["skills/octon-mini-project-bootstrap/scripts/setup_session.py"],
      "default_behavior": "read_only",
      "mutation_behavior": "May write only a specifically requested setup-session artifact outside the target project.",
      "authorization_boundary": "Inspection needs no mutation authority; an external session write requires an explicit output path and grants no project authority.",
      "limitations": ["Does not apply a transaction, accept a decision, run project hooks, or grant runtime permission."]
    },
    {
      "id": "bootstrap.initialization",
      "display_name": "Octon Mini Project Initialization",
      "purpose": "Initialize a new empty project with an Octon Mini harness and dossier.",
      "availability": ["bootstrap_source"],
      "command_entry_points": ["octon init plan", "octon init apply"],
      "implementation_entry_points": ["skills/octon-mini-project-bootstrap/scripts/init_project.py", "skills/octon-mini-project-bootstrap/scripts/scaffold_project.py"],
      "default_behavior": "mixed",
      "mutation_behavior": "Read-only planning followed by a digest-bound empty-target transaction.",
      "authorization_boundary": "Apply requires an explicit profile, reviewed plan digest, unchanged inputs, and repository-local implementation authority.",
      "limitations": ["Never overwrites an existing path and does not establish harness adoption or project readiness."]
    },
    {
      "id": "bootstrap.adoption",
      "display_name": "Octon Mini Project Adoption",
      "purpose": "Add an Octon Mini baseline to an established project without replacing project-owned authority.",
      "availability": ["bootstrap_source"],
      "command_entry_points": ["octon adopt plan", "octon adopt apply"],
      "implementation_entry_points": ["skills/octon-mini-project-bootstrap/scripts/adopt_project.py", "skills/octon-mini-project-bootstrap/scripts/plan_adoption.py"],
      "default_behavior": "mixed",
      "mutation_behavior": "Read-only semantic proposal and planning followed by a reviewed no-overwrite local transaction.",
      "authorization_boundary": "Apply requires explicit dispositions for collisions and functional equivalents plus the exact reviewed digest.",
      "limitations": ["Leaves adoption in progress and never treats structural installation as accepted authority or readiness."]
    },
    {
      "id": "bootstrap.upgrade",
      "display_name": "Octon Mini Project Upgrade",
      "purpose": "Plan or apply a deliberate Octon Mini migration, including a reviewed cross-brand transition from a legacy snapshot.",
      "availability": ["bootstrap_source"],
      "command_entry_points": ["octon upgrade plan", "octon upgrade apply"],
      "implementation_entry_points": ["skills/octon-mini-project-bootstrap/scripts/upgrade_project.py", "skills/octon-mini-project-bootstrap/scripts/migrate_3_1_0_to_4_0_0.py"],
      "default_behavior": "mixed",
      "mutation_behavior": "Three-way, digest-bound local migration with exact rollback evidence.",
      "authorization_boundary": "Apply requires reviewed classifications, preserved project authority, exact current preimages, and the accepted migration digest.",
      "limitations": ["Legacy launcher material is inert migration input only and is never executed or retained as runtime compatibility."]
    },
    {
      "id": "bootstrap.detection",
      "display_name": "Octon Mini Project Detection",
      "purpose": "Inspect a project and propose bootstrap archetype, hook, and setup inputs.",
      "availability": ["bootstrap_source"],
      "command_entry_points": ["octon detect"],
      "implementation_entry_points": ["skills/octon-mini-project-bootstrap/scripts/detect_project.py"],
      "default_behavior": "read_only",
      "mutation_behavior": "None.",
      "authorization_boundary": "Local inspection only; hosted observation requires separate authority outside this command.",
      "limitations": ["Proposals are non-authorizing and do not configure the target."]
    },
    {
      "id": "project.validation",
      "display_name": "Octon Mini Project Validation",
      "purpose": "Run read-only structural, contract, lifecycle, and integrity validation for a generated project.",
      "availability": ["generated_project"],
      "command_entry_points": ["octon check"],
      "implementation_entry_points": [".agent/scripts/octon.py", ".agent/scripts/validate.py"],
      "default_behavior": "read_only",
      "mutation_behavior": "None; bytecode and cache writes are suppressed and project hooks are not executed.",
      "authorization_boundary": "Relevant local read access only.",
      "limitations": ["Structural success does not prove adoption, implementation quality, specialist approval, release readiness, or production readiness."]
    },
    {
      "id": "project.diagnostics",
      "display_name": "Octon Mini Diagnostics and Recovery",
      "purpose": "Diagnose integrity and recovery problems and propose bounded derived repairs.",
      "availability": ["generated_project"],
      "command_entry_points": ["octon doctor"],
      "implementation_entry_points": [".agent/scripts/octon.py", ".agent/scripts/octon_doctor.py"],
      "default_behavior": "read_only",
      "mutation_behavior": "A separately selected repair may write only reviewed derived paths through a digest-bound transaction.",
      "authorization_boundary": "Diagnosis is read-only; repair requires explicit selection and the exact reviewed digest.",
      "limitations": ["Cannot repair project-owned authority, substantive evidence, decisions, credentials, or external state."]
    },
    {
      "id": "work.lifecycle",
      "display_name": "Octon Mini Work Lifecycle",
      "purpose": "Start, block, close, reopen, hand off, or resume governed project work.",
      "availability": ["generated_project"],
      "command_entry_points": ["octon work start", "octon work block", "octon work close", "octon work reopen", "octon work handoff", "octon work resume"],
      "implementation_entry_points": [".agent/scripts/octon.py", ".agent/scripts/octon_transaction.py"],
      "default_behavior": "mixed",
      "mutation_behavior": "Lifecycle changes use reviewed local plan/apply transactions; resume is read-only.",
      "authorization_boundary": "Mutations require explicit task semantics, existing authority references, satisfied lifecycle gates, and the exact reviewed digest.",
      "limitations": ["Task records describe and constrain work but do not authorize external effects."]
    },
    {
      "id": "work.completion",
      "display_name": "Octon Mini Governed Work Completion",
      "purpose": "Plan and resume governed Git and provider work completion for an adopted small-team workflow.",
      "availability": ["generated_project"],
      "command_entry_points": ["octon work finish plan", "octon work finish apply", "octon work finish resume"],
      "implementation_entry_points": [".agent/scripts/octon.py", ".agent/scripts/octon_work_completion.py"],
      "default_behavior": "mixed",
      "mutation_behavior": "Planning is read-only; apply and resume use monotonic receipts for explicitly authorized local and external effects.",
      "authorization_boundary": "Every external operation requires current task-scoped authorization bound to the reviewed digest and revalidated live preconditions.",
      "limitations": ["External effects are resumable rather than atomically reversible; self-review never becomes peer approval."]
    },
    {
      "id": "work.long_running",
      "display_name": "Octon Mini Long-Running Work",
      "purpose": "Govern one external worker through bounded context, validated progress, measurable limits, committed checkpoints, and deterministic resumption.",
      "availability": ["generated_project"],
      "command_entry_points": ["octon work run"],
      "implementation_entry_points": [".agent/scripts/octon.py", ".agent/capabilities/long-running-work/long_work.py"],
      "default_behavior": "mixed",
      "mutation_behavior": "Dormant dispatch when absent; an explicitly installed and adopted package writes only package-owned run state while task effects remain in existing transaction or work-completion boundaries.",
      "authorization_boundary": "Requires an installed content-addressed package, explicit project adoption, an existing task authority basis, exact path narrowing, current bindings, and current validation.",
      "limitations": ["Does not host a model, create task scope, grant permission, or replay an ambiguous effect."]
    },
    {
      "id": "work.autonomous_delivery",
      "display_name": "Octon Mini Governed Autonomous Delivery",
      "purpose": "Discover, assess, preview, activate, and govern bounded autonomous delivery for an already human-prioritized task.",
      "availability": ["bootstrap_source", "generated_project"],
      "command_entry_points": ["octon delivery"],
      "implementation_entry_points": [".agent/scripts/octon.py", ".agent/scripts/octon_autonomous_delivery.py", ".agent/capabilities/autonomous-delivery/delivery_runtime.py"],
      "default_behavior": "mixed",
      "mutation_behavior": "Research, context, assessment, planning, status, explanation, and activation preview are read-only before activation; write-capable behavior requires the exact independently confirmed standing contract and locally bundled package activation.",